{
	"_meta":	{
		"version":	12,
		"format":	"v12_old",
		"level":	54,
		"sublevel":	1,
		"checksum":	0
	},
	"path":	"P:\\CROC\\EDITOR\\MAPS\\GAME\\ISLAND5\\LEVEL5\\MAP54_01.MAP",
	"name":	"avalanche escape 2",
	"width":	16,
	"height":	16,
	"depth":	32,
	"style":	"ice",
	"flags":	0,
	"cd_track":	29,
	"background":	17,
	"effect":	"none",
	"wait":	16,
	"ambience":	"none",
	"start_rotation":	-0.02197265625,
	"tracks":	[{
			"position":	[2, 0, 2],
			"yr":	0.25,
			"index":	42
		}, {
			"position":	[6, 0, 2],
			"yr":	0.5,
			"index":	39
		}, {
			"position":	[7, 0, 2],
			"yr":	0.25,
			"index":	39
		}, {
			"position":	[12, 0, 2],
			"yr":	0.75,
			"index":	42
		}, {
			"position":	[2, 0, 3],
			"yr":	0.25,
			"index":	42
		}, {
			"position":	[6, 0, 3],
			"yr":	0.75,
			"index":	39
		}, {
			"position":	[7, 0, 3],
			"yr":	0,
			"index":	39
		}, {
			"position":	[12, 0, 3],
			"yr":	0.75,
			"index":	42
		}, {
			"position":	[2, 0, 4],
			"yr":	0.25,
			"index":	42
		}, {
			"position":	[3, 0, 4],
			"yr":	0.5,
			"index":	39
		}, {
			"position":	[4, 0, 4],
			"yr":	0.25,
			"index":	39
		}, {
			"position":	[12, 0, 4],
			"yr":	0.75,
			"index":	42
		}, {
			"position":	[2, 0, 5],
			"yr":	0.25,
			"index":	44
		}, {
			"position":	[3, 0, 5],
			"yr":	0.75,
			"index":	39
		}, {
			"position":	[4, 0, 5],
			"yr":	0,
			"index":	39
		}, {
			"position":	[8, 2, 5],
			"yr":	0.5,
			"index":	62
		}, {
			"position":	[12, 0, 5],
			"yr":	0.75,
			"index":	43
		}, {
			"position":	[2, 0, 6],
			"yr":	0.25,
			"index":	45
		}, {
			"position":	[3, 0, 6],
			"yr":	0.25,
			"index":	39
		}, {
			"position":	[8, 0, 6],
			"yr":	0,
			"index":	58
		}, {
			"position":	[9, 0, 6],
			"yr":	0.25,
			"index":	61
		}, {
			"position":	[10, 0, 6],
			"yr":	0,
			"index":	61
		}, {
			"position":	[11, 0, 6],
			"yr":	0.5,
			"index":	39
		}, {
			"position":	[12, 0, 6],
			"yr":	0.75,
			"index":	46
		}, {
			"position":	[1, 0, 7],
			"yr":	0.25,
			"index":	73
		}, {
			"position":	[2, 0, 7],
			"yr":	0.25,
			"index":	72
		}, {
			"position":	[3, 0, 7],
			"yr":	0.25,
			"index":	37
		}, {
			"position":	[8, 0, 7],
			"yr":	0.5,
			"index":	61
		}, {
			"position":	[9, 0, 7],
			"yr":	0.75,
			"index":	61
		}, {
			"position":	[10, 0, 7],
			"yr":	0.5,
			"index":	61
		}, {
			"position":	[11, 0, 7],
			"yr":	0.75,
			"index":	65
		}, {
			"position":	[12, 0, 7],
			"yr":	0.75,
			"index":	72
		}, {
			"position":	[13, 0, 7],
			"yr":	0.75,
			"index":	73
		}, {
			"position":	[2, 0, 8],
			"yr":	0.25,
			"index":	46
		}, {
			"position":	[3, 0, 8],
			"yr":	0,
			"index":	39
		}, {
			"position":	[11, 0, 8],
			"yr":	0.75,
			"index":	39
		}, {
			"position":	[12, 0, 8],
			"yr":	0.75,
			"index":	45
		}, {
			"position":	[2, 0, 9],
			"yr":	0.25,
			"index":	43
		}, {
			"position":	[12, 0, 9],
			"yr":	0.75,
			"index":	44
		}, {
			"position":	[12, 0, 10],
			"yr":	0.75,
			"index":	42
		}],
	"strats":	[{
			"params":	[65536, 0, 0, 0, 0, 0, 0, 0],
			"position":	[3.28125, 0, 6.03125],
			"rotation":	[0, 0, 0],
			"name":	"PlatformCrumble",
			"waypoints":	[]
		}, {
			"params":	[65536, 0, 0, 0, 0, 0, 0, 0],
			"position":	[3.59375, 0, 5.46875],
			"rotation":	[0, 0, 0],
			"name":	"PlatformCrumble",
			"waypoints":	[]
		}, {
			"params":	[0, 0, 0, 0, 0, 0, 0, 0],
			"position":	[3.5, 0, 4.59375],
			"rotation":	[0, 0, 0],
			"name":	"FunkyMonkey",
			"waypoints":	[{
					"position":	[3.5, 0, 4.59375],
					"var":	327680
				}]
		}, {
			"params":	[0, 0, 0, 0, 0, 0, 0, 0],
			"position":	[6.46875, 0, 2.59375],
			"rotation":	[0, 0.846435546875, 0],
			"name":	"FunkyMonkey",
			"waypoints":	[{
					"position":	[6.46875, 0, 2.59375],
					"var":	262144
				}]
		}, {
			"params":	[0, 0, 0, 0, 131072, 0, 0, 0],
			"position":	[4.15625, 0, 3.96875],
			"rotation":	[0, 0, 0],
			"name":	"PlatformNormal",
			"waypoints":	[{
					"position":	[4.15625, 0, 3.96875],
					"var":	0
				}, {
					"position":	[4.1875, 0, 3.1875],
					"var":	0
				}, {
					"position":	[4.96875, 0, 3.15625],
					"var":	0
				}, {
					"position":	[4.96875, 0, 3.96875],
					"var":	0
				}]
		}, {
			"params":	[0, 0, 65536, 0, 131072, 0, 0, 0],
			"position":	[5.71875, 0.17999267578125, 3.53125],
			"rotation":	[0, 0, 0],
			"name":	"PlatformNormal",
			"waypoints":	[{
					"position":	[5.71875, 0.1899871826171875, 3.53125],
					"var":	0
				}, {
					"position":	[5.53125, 0.16998291015625, 2.71875],
					"var":	0
				}, {
					"position":	[4.53125, 0.2199859619140625, 2.75],
					"var":	0
				}]
		}, {
			"params":	[0, 0, 0, 0, 0, 0, 0, 0],
			"position":	[2.53125, 0.399993896484375, 7.40625],
			"rotation":	[0, 0, 0],
			"name":	"Crystal",
			"waypoints":	[]
		}, {
			"params":	[0, 0, 0, 0, 0, 0, 0, 0],
			"position":	[2.53125, 0.6999969482421875, 7.40625],
			"rotation":	[0, 0, 0],
			"name":	"Crystal",
			"waypoints":	[]
		}, {
			"params":	[0, 0, 0, 0, 0, 0, 0, 0],
			"position":	[9.375, 0.2499847412109375, 6.09375],
			"rotation":	[0, 0, 0],
			"name":	"Crystal",
			"waypoints":	[]
		}, {
			"params":	[0, 0, 0, 0, 0, 0, 0, 0],
			"position":	[9.625, 0.239990234375, 6.09375],
			"rotation":	[0, 0, 0],
			"name":	"Crystal",
			"waypoints":	[]
		}, {
			"params":	[0, 0, 0, 0, 0, 0, 0, 0],
			"position":	[9.78125, 0.2599945068359375, 6.21875],
			"rotation":	[0, 0, 0],
			"name":	"Crystal",
			"waypoints":	[]
		}, {
			"params":	[0, 0, 0, 0, 0, 0, 0, 0],
			"position":	[9.84375, 0.269989013671875, 6.375],
			"rotation":	[0, 0, 0],
			"name":	"Crystal",
			"waypoints":	[]
		}, {
			"params":	[0, 0, 0, 0, 0, 0, 0, 0],
			"position":	[9.9375, 0.2499847412109375, 6.59375],
			"rotation":	[0, 0, 0],
			"name":	"Crystal",
			"waypoints":	[]
		}, {
			"params":	[0, 0, 0, 0, 0, 0, 0, 0],
			"position":	[10.09375, 0.17999267578125, 6.71875],
			"rotation":	[0, 0, 0],
			"name":	"Crystal",
			"waypoints":	[]
		}, {
			"params":	[0, 0, 0, 0, 0, 0, 0, 0],
			"position":	[10.25, 0.1299896240234375, 6.8125],
			"rotation":	[0, 0, 0],
			"name":	"Crystal",
			"waypoints":	[]
		}, {
			"params":	[65536, 0, 0, 0, 0, 0, 0, 0],
			"position":	[7.9375, 0.29998779296875, 4.51373291015625],
			"rotation":	[0, 0, 0],
			"name":	"PlatformCrumble",
			"waypoints":	[]
		}, {
			"params":	[0, 0, 0, 0, 0, 0, 0, 0],
			"position":	[10.25, -0.29998779296875, 5.28125],
			"rotation":	[0, 0, 0],
			"name":	"PlatformDead",
			"waypoints":	[]
		}, {
			"params":	[0, 0, 0, 0, 0, 0, 0, 0],
			"position":	[10.25, -0.1299896240234375, 5.28125],
			"rotation":	[0, 0, 0],
			"name":	"Gobbo",
			"waypoints":	[]
		}, {
			"params":	[0, 0, 0, 655360, 65536, 0, 0, 0],
			"position":	[8.375, 0, 2.625],
			"rotation":	[0, 0, 0],
			"name":	"PlatformSpin",
			"waypoints":	[]
		}, {
			"params":	[0, 0, 0, 0, 0, 0, 0, 0],
			"position":	[8.5, 0, 4.4375],
			"rotation":	[0, 0, 0],
			"name":	"PlatformCrumble",
			"waypoints":	[]
		}],
	"doors":	[{
			"position":	[1, 0, 7],
			"level":	54,
			"sublevel":	0,
			"flags":	["normal", "start"],
			"id":	0
		}, {
			"position":	[13, 0, 7],
			"level":	54,
			"sublevel":	2,
			"flags":	["normal"],
			"id":	0
		}],
	"point_lights":	[{
			"position":	[147, 7.9998779296875, -1.0999908447265625],
			"colour":	[140, 255, 255],
			"fade_from":	0.001953125,
			"fade_to":	26368.005859375
		}, {
			"position":	[10495.99609375, 26368.04296875, -20736.00390625],
			"colour":	[255, 242, 0],
			"fade_from":	-32768,
			"fade_to":	1.52587890625e-05
		}],
	"direct_lights":	[{
			"position":	[1, 0, 0],
			"colour":	[64, 0, 0]
		}, {
			"position":	[0.5, 0.865966796875, 0],
			"colour":	[128, 0, 0]
		}, {
			"position":	[0.5, -0.000244140625, 0],
			"colour":	[43, 0, 16]
		}],
	"ambient_colour":	[56, 0, 33]
}