{
	"_meta":	{
		"version":	20,
		"format":	"normal",
		"level":	42,
		"sublevel":	2,
		"checksum":	28986
	},
	"path":	"P:\\CROC\\EDITOR\\MAPS\\GAME\\CASTLE\\LEVEL3\\MAP3.MAP",
	"name":	"Default New Map",
	"width":	16,
	"height":	16,
	"depth":	32,
	"style":	"dungeon",
	"flags":	0,
	"cd_track":	34,
	"background":	0,
	"effect":	"none",
	"wait":	0,
	"ambience":	"wind",
	"start_rotation":	0.013671875,
	"tracks":	[{
			"position":	[3, 0, 0],
			"yr":	0,
			"index":	16
		}, {
			"position":	[1, 0, 1],
			"yr":	0,
			"index":	13
		}, {
			"position":	[2, 0, 1],
			"yr":	0,
			"index":	0
		}, {
			"position":	[3, 0, 1],
			"yr":	0,
			"index":	15
		}, {
			"position":	[4, 0, 1],
			"yr":	0,
			"index":	0
		}, {
			"position":	[5, 0, 1],
			"yr":	0.75,
			"index":	13
		}, {
			"position":	[1, 0, 2],
			"yr":	0.25,
			"index":	0
		}, {
			"position":	[2, 0, 2],
			"yr":	0,
			"index":	3
		}, {
			"position":	[3, 0, 2],
			"yr":	0,
			"index":	3
		}, {
			"position":	[4, 0, 2],
			"yr":	0,
			"index":	3
		}, {
			"position":	[5, 0, 2],
			"yr":	0.75,
			"index":	0
		}, {
			"position":	[1, 0, 3],
			"yr":	0.25,
			"index":	0
		}, {
			"position":	[2, 0, 3],
			"yr":	0,
			"index":	3
		}, {
			"position":	[3, 0, 3],
			"yr":	0,
			"index":	11
		}, {
			"position":	[4, 0, 3],
			"yr":	0,
			"index":	3
		}, {
			"position":	[5, 0, 3],
			"yr":	0.75,
			"index":	0
		}, {
			"position":	[1, 0, 4],
			"yr":	0.25,
			"index":	0
		}, {
			"position":	[2, 0, 4],
			"yr":	0,
			"index":	3
		}, {
			"position":	[3, 0, 4],
			"yr":	0,
			"index":	3
		}, {
			"position":	[4, 0, 4],
			"yr":	0,
			"index":	3
		}, {
			"position":	[5, 0, 4],
			"yr":	0.75,
			"index":	0
		}, {
			"position":	[1, 0, 5],
			"yr":	0.25,
			"index":	13
		}, {
			"position":	[2, 0, 5],
			"yr":	0.5,
			"index":	0
		}, {
			"position":	[3, 0, 5],
			"yr":	0.5,
			"index":	15
		}, {
			"position":	[4, 0, 5],
			"yr":	0.5,
			"index":	0
		}, {
			"position":	[5, 0, 5],
			"yr":	0.5,
			"index":	13
		}, {
			"position":	[3, 0, 6],
			"yr":	0.5,
			"index":	16
		}],
	"strats":	[{
			"params":	[0, 0, 0, 0, 0, 0, 0, 0],
			"position":	[48, 0, 7.179931640625],
			"rotation":	[0, 0, 0],
			"name":	"OneWayDoor",
			"waypoints":	[]
		}, {
			"params":	[0, 0, 0, 0, 0, 0, 0, 0],
			"position":	[48, 0, 88.519775390625],
			"rotation":	[0, 0.49951171875, 0],
			"name":	"NormalDoor",
			"waypoints":	[]
		}, {
			"params":	[0, 0, 0, 0, 0, 0, 0, 0],
			"position":	[72, 0, 48],
			"rotation":	[0, 0, 0],
			"name":	"ChaseMeBlock",
			"waypoints":	[{
					"position":	[78, 0, 80.5],
					"var":	0
				}, {
					"position":	[16, 0, 17],
					"var":	0
				}]
		}, {
			"params":	[0, 0, 0, 0, 0, 0, 0, 0],
			"position":	[48, -1.599853515625, 48.5],
			"rotation":	[0, 0.49951171875, 0],
			"name":	"SpookySpider",
			"waypoints":	[]
		}, {
			"params":	[655360, 0, 0, 0, 0, 0, 0, 0],
			"position":	[72, -1.599853515625, 71.89990234375],
			"rotation":	[0, 0.610595703125, 0],
			"name":	"SpookySpider",
			"waypoints":	[]
		}, {
			"params":	[1310720, 0, 0, 0, 0, 0, 0, 0],
			"position":	[24.39990234375, -1.599853515625, 71.89990234375],
			"rotation":	[0, 0.37451171875, 0],
			"name":	"SpookySpider",
			"waypoints":	[]
		}, {
			"params":	[1966080, 0, 0, 0, 0, 0, 0, 0],
			"position":	[24.39990234375, -1.599853515625, 24.89990234375],
			"rotation":	[0, 0.124755859375, 0],
			"name":	"SpookySpider",
			"waypoints":	[]
		}, {
			"params":	[2621440, 0, 0, 0, 0, 0, 0, 0],
			"position":	[72, -1.599853515625, 25.39990234375],
			"rotation":	[0, 0.8603515625, 0],
			"name":	"SpookySpider",
			"waypoints":	[]
		}],
	"doors":	[{
			"position":	[3, 0, 0],
			"level":	42,
			"sublevel":	1,
			"flags":	["normal"],
			"id":	0
		}, {
			"position":	[3, 0, 1],
			"level":	0,
			"sublevel":	0,
			"flags":	["start"],
			"id":	0
		}, {
			"position":	[3, 0, 6],
			"level":	42,
			"sublevel":	3,
			"flags":	["normal"],
			"id":	0
		}],
	"point_lights":	[{
			"position":	[1, 0, 1.09375],
			"colour":	[174, 107, 255],
			"fade_from":	1,
			"fade_to":	2
		}, {
			"position":	[1, 0, 4.96875],
			"colour":	[255, 255, 102],
			"fade_from":	1,
			"fade_to":	2
		}, {
			"position":	[4.875, 0, 5],
			"colour":	[102, 179, 95],
			"fade_from":	1,
			"fade_to":	2
		}, {
			"position":	[4.875, 0, 1.1875],
			"colour":	[104, 75, 148],
			"fade_from":	1,
			"fade_to":	2
		}, {
			"position":	[3, 0, 3.0625],
			"colour":	[255, 255, 79],
			"fade_from":	1,
			"fade_to":	2
		}],
	"direct_lights":	[{
			"position":	[0, 1, 0],
			"colour":	[64, 64, 64]
		}, {
			"position":	[0, 0.5, 0.865966796875],
			"colour":	[255, 255, 128]
		}, {
			"position":	[0, 0.5, -0.000244140625],
			"colour":	[43, 43, 43]
		}],
	"ambient_colour":	[43, 39, 39]
}