{
	"_meta":	{
		"version":	12,
		"format":	"v12_old",
		"level":	2,
		"sublevel":	2,
		"checksum":	0
	},
	"path":	"P:\\CROC\\EDITOR\\MAPS\\LEWIS\\MAP3.MAP",
	"name":	"Default New Map",
	"width":	16,
	"height":	16,
	"depth":	32,
	"style":	"desert",
	"flags":	0,
	"cd_track":	0,
	"background":	0,
	"effect":	"none",
	"wait":	0,
	"ambience":	"none",
	"start_rotation":	-0.0341796875,
	"tracks":	[{
			"position":	[2, 0, 1],
			"yr":	0.25,
			"index":	6
		}, {
			"position":	[3, 0, 1],
			"yr":	0,
			"index":	5
		}, {
			"position":	[4, 0, 1],
			"yr":	0,
			"index":	5
		}, {
			"position":	[5, 0, 1],
			"yr":	0,
			"index":	6
		}, {
			"position":	[2, 0, 2],
			"yr":	0.25,
			"index":	5
		}, {
			"position":	[3, 0, 2],
			"yr":	0,
			"index":	37
		}, {
			"position":	[4, 0, 2],
			"yr":	0,
			"index":	37
		}, {
			"position":	[5, 0, 2],
			"yr":	0.75,
			"index":	7
		}, {
			"position":	[6, 0, 2],
			"yr":	0,
			"index":	6
		}, {
			"position":	[2, 0, 3],
			"yr":	0.25,
			"index":	5
		}, {
			"position":	[3, 0, 3],
			"yr":	0.5,
			"index":	22
		}, {
			"position":	[4, 0, 3],
			"yr":	0.5,
			"index":	12
		}, {
			"position":	[5, 0, 3],
			"yr":	0.25,
			"index":	22
		}, {
			"position":	[6, 0, 3],
			"yr":	0.75,
			"index":	5
		}, {
			"position":	[2, 0, 4],
			"yr":	0.25,
			"index":	5
		}, {
			"position":	[3, 0, 4],
			"yr":	0.75,
			"index":	12
		}, {
			"position":	[5, 0, 4],
			"yr":	0.25,
			"index":	12
		}, {
			"position":	[6, 0, 4],
			"yr":	0.75,
			"index":	5
		}, {
			"position":	[2, 0, 5],
			"yr":	0.25,
			"index":	5
		}, {
			"position":	[3, 0, 5],
			"yr":	0.75,
			"index":	22
		}, {
			"position":	[4, 0, 5],
			"yr":	0,
			"index":	12
		}, {
			"position":	[5, 0, 5],
			"yr":	0,
			"index":	22
		}, {
			"position":	[6, 0, 5],
			"yr":	0.75,
			"index":	5
		}, {
			"position":	[2, 0, 6],
			"yr":	0.5,
			"index":	6
		}, {
			"position":	[3, 0, 6],
			"yr":	0.5,
			"index":	5
		}, {
			"position":	[4, 0, 6],
			"yr":	0.5,
			"index":	5
		}, {
			"position":	[5, 0, 6],
			"yr":	0.5,
			"index":	5
		}, {
			"position":	[6, 0, 6],
			"yr":	0.75,
			"index":	6
		}, {
			"position":	[3, 8, 3],
			"yr":	0.5,
			"index":	80
		}, {
			"position":	[4, 8, 3],
			"yr":	0.5,
			"index":	78
		}, {
			"position":	[5, 8, 3],
			"yr":	0.25,
			"index":	80
		}, {
			"position":	[3, 8, 4],
			"yr":	0.75,
			"index":	78
		}, {
			"position":	[4, 8, 4],
			"yr":	0,
			"index":	37
		}, {
			"position":	[5, 8, 4],
			"yr":	0.25,
			"index":	78
		}, {
			"position":	[3, 8, 5],
			"yr":	0.75,
			"index":	80
		}, {
			"position":	[4, 8, 5],
			"yr":	0,
			"index":	78
		}, {
			"position":	[5, 8, 5],
			"yr":	0,
			"index":	80
		}],
	"strats":	[{
			"params":	[0, 0, 0, 0, 0, 0, 0, 0],
			"position":	[3.71875, 0.17999267578125, 2.03125],
			"rotation":	[0, 0, 0],
			"name":	"PlatformDead",
			"waypoints":	[]
		}, {
			"params":	[0, 0, 0, 0, 0, 0, 0, 0],
			"position":	[4.34375, 0.5, 2.0625],
			"rotation":	[0, 0, 0],
			"name":	"PlatformDead",
			"waypoints":	[]
		}, {
			"params":	[0, 0, 0, 0, 0, 0, 0, 0],
			"position":	[4.78125, 0.8499908447265625, 2.342498779296875],
			"rotation":	[0, 0, 0],
			"name":	"PlatformDead",
			"waypoints":	[]
		}],
	"doors":	[{
			"position":	[3, 0, 2],
			"level":	0,
			"sublevel":	0,
			"flags":	["start"],
			"id":	0
		}, {
			"position":	[4, 0, 2],
			"level":	0,
			"sublevel":	0,
			"flags":	[],
			"id":	0
		}],
	"point_lights":	[],
	"direct_lights":	[{
			"position":	[0, 1, 0],
			"colour":	[64, 64, 64]
		}, {
			"position":	[0, 0.5, 0.865966796875],
			"colour":	[255, 255, 128]
		}, {
			"position":	[0, 0.5, -0.000244140625],
			"colour":	[43, 43, 43]
		}],
	"ambient_colour":	[64, 64, 64]
}