{
	"_meta":	{
		"version":	12,
		"format":	"v12_old",
		"level":	0,
		"sublevel":	2,
		"checksum":	0
	},
	"path":	"P:\\CROC\\EDITOR\\MAPS\\TONY\\SNOWTEST.MAP",
	"name":	"Snow Test",
	"width":	3,
	"height":	3,
	"depth":	1,
	"style":	"ice",
	"flags":	0,
	"cd_track":	0,
	"background":	0,
	"effect":	"snow",
	"wait":	16,
	"ambience":	"none",
	"start_rotation":	0,
	"tracks":	[{
			"position":	[0, 0, 0],
			"yr":	0.25,
			"index":	30
		}, {
			"position":	[1, 0, 0],
			"yr":	0,
			"index":	28
		}, {
			"position":	[2, 0, 0],
			"yr":	0,
			"index":	30
		}, {
			"position":	[0, 0, 1],
			"yr":	0.25,
			"index":	28
		}, {
			"position":	[1, 0, 1],
			"yr":	0.5,
			"index":	6
		}, {
			"position":	[2, 0, 1],
			"yr":	0.75,
			"index":	28
		}, {
			"position":	[0, 0, 2],
			"yr":	0.5,
			"index":	30
		}, {
			"position":	[1, 0, 2],
			"yr":	0.5,
			"index":	28
		}, {
			"position":	[2, 0, 2],
			"yr":	0.75,
			"index":	30
		}],
	"strats":	[],
	"doors":	[{
			"position":	[1, 0, 1],
			"level":	0,
			"sublevel":	0,
			"flags":	["start"],
			"id":	0
		}],
	"point_lights":	[],
	"direct_lights":	[{
			"position":	[0, 1, 0],
			"colour":	[64, 64, 64]
		}, {
			"position":	[0, 0.5, 0.865966796875],
			"colour":	[255, 255, 128]
		}, {
			"position":	[0, 0.5, -0.865966796875],
			"colour":	[43, 43, 43]
		}],
	"ambient_colour":	[64, 64, 64]
}