{
	"_meta":	{
		"version":	12,
		"format":	"v12_old",
		"level":	20,
		"sublevel":	0,
		"checksum":	0
	},
	"path":	"P:\\CROC\\EDITOR\\MAPS\\GAME\\ISLAND2\\LEVEL1\\MAP1.MAP",
	"name":	"Default New Map",
	"width":	16,
	"height":	16,
	"depth":	32,
	"style":	"ice",
	"flags":	4,
	"cd_track":	0,
	"background":	3,
	"effect":	"snow",
	"wait":	16,
	"ambience":	"none",
	"start_rotation":	0.002685546875,
	"tracks":	[{
			"position":	[3, 0, 2],
			"yr":	0.25,
			"index":	22
		}, {
			"position":	[4, 0, 2],
			"yr":	0,
			"index":	23
		}, {
			"position":	[5, 0, 2],
			"yr":	0,
			"index":	22
		}, {
			"position":	[3, 0, 3],
			"yr":	0.25,
			"index":	23
		}, {
			"position":	[4, 0, 3],
			"yr":	0,
			"index":	1
		}, {
			"position":	[5, 0, 3],
			"yr":	0.75,
			"index":	23
		}, {
			"position":	[3, 0, 4],
			"yr":	0.25,
			"index":	67
		}, {
			"position":	[4, 0, 4],
			"yr":	0,
			"index":	3
		}, {
			"position":	[5, 0, 4],
			"yr":	0.75,
			"index":	68
		}, {
			"position":	[3, 0, 5],
			"yr":	0.25,
			"index":	39
		}, {
			"position":	[4, 0, 5],
			"yr":	0,
			"index":	2
		}, {
			"position":	[5, 0, 5],
			"yr":	0.75,
			"index":	39
		}, {
			"position":	[0, 0, 6],
			"yr":	0,
			"index":	80
		}, {
			"position":	[1, 0, 6],
			"yr":	0,
			"index":	25
		}, {
			"position":	[2, 0, 6],
			"yr":	0,
			"index":	43
		}, {
			"position":	[3, 0, 6],
			"yr":	0,
			"index":	41
		}, {
			"position":	[4, 0, 6],
			"yr":	0.25,
			"index":	10
		}, {
			"position":	[5, 0, 6],
			"yr":	0.75,
			"index":	41
		}, {
			"position":	[6, 0, 6],
			"yr":	0,
			"index":	104
		}, {
			"position":	[7, 0, 6],
			"yr":	0,
			"index":	25
		}, {
			"position":	[8, 0, 6],
			"yr":	0.75,
			"index":	80
		}, {
			"position":	[0, 0, 7],
			"yr":	0.25,
			"index":	80
		}, {
			"position":	[1, 0, 7],
			"yr":	0.5,
			"index":	25
		}, {
			"position":	[2, 0, 7],
			"yr":	0.5,
			"index":	104
		}, {
			"position":	[3, 0, 7],
			"yr":	0.25,
			"index":	41
		}, {
			"position":	[4, 0, 7],
			"yr":	0.75,
			"index":	10
		}, {
			"position":	[5, 0, 7],
			"yr":	0.5,
			"index":	41
		}, {
			"position":	[6, 0, 7],
			"yr":	0.5,
			"index":	43
		}, {
			"position":	[7, 0, 7],
			"yr":	0.5,
			"index":	25
		}, {
			"position":	[8, 0, 7],
			"yr":	0.5,
			"index":	80
		}, {
			"position":	[3, 0, 8],
			"yr":	0.25,
			"index":	39
		}, {
			"position":	[4, 0, 8],
			"yr":	0,
			"index":	2
		}, {
			"position":	[5, 0, 8],
			"yr":	0.75,
			"index":	39
		}, {
			"position":	[3, 0, 9],
			"yr":	0.25,
			"index":	68
		}, {
			"position":	[4, 0, 9],
			"yr":	0.5,
			"index":	3
		}, {
			"position":	[5, 0, 9],
			"yr":	0.75,
			"index":	67
		}, {
			"position":	[3, 0, 10],
			"yr":	0.5,
			"index":	22
		}, {
			"position":	[4, 0, 10],
			"yr":	0.5,
			"index":	114
		}, {
			"position":	[5, 0, 10],
			"yr":	0.75,
			"index":	22
		}, {
			"position":	[4, 0, 11],
			"yr":	0.5,
			"index":	111
		}],
	"strats":	[{
			"params":	[0, 0, 0, 1310720, 39320, 0, 0, 0],
			"position":	[4, 0, 4.83123779296875],
			"rotation":	[0, 0.3330078125, 0],
			"name":	"PlatformSpin",
			"waypoints":	[]
		}, {
			"params":	[0, 0, 0, 1310720, 39320, 0, 0, 0],
			"position":	[4, 0, 4.83123779296875],
			"rotation":	[0, 0.666015625, 0],
			"name":	"PlatformSpin",
			"waypoints":	[]
		}, {
			"params":	[0, 0, 0, 1310720, 39320, 0, 0, 0],
			"position":	[4, 0, 4.83123779296875],
			"rotation":	[0, 0, 0],
			"name":	"PlatformSpin",
			"waypoints":	[]
		}, {
			"params":	[0, 0, 0, 1310720, 39320, 0, 0, 0],
			"position":	[4, 0, 8.26249694824219],
			"rotation":	[0, 0, 0],
			"name":	"PlatformSpin",
			"waypoints":	[]
		}, {
			"params":	[0, 0, 0, 1310720, 39320, 0, 0, 0],
			"position":	[4, 0, 8.26249694824219],
			"rotation":	[0, 0.666015625, 0],
			"name":	"PlatformSpin",
			"waypoints":	[]
		}, {
			"params":	[0, 0, 0, 1310720, 39320, 0, 0, 0],
			"position":	[4, 0, 8.26249694824219],
			"rotation":	[0, 0.3330078125, 0],
			"name":	"PlatformSpin",
			"waypoints":	[]
		}, {
			"params":	[0, 0, 0, 0, 0, 0, 0, 0],
			"position":	[4, 0, 4.79998779296875],
			"rotation":	[0, 0, 0],
			"name":	"PlatformStepStone",
			"waypoints":	[]
		}, {
			"params":	[0, 0, 0, 0, 0, 0, 0, 0],
			"position":	[4, 0, 8.26249694824219],
			"rotation":	[0, 0, 0],
			"name":	"PlatformStepStone",
			"waypoints":	[]
		}, {
			"params":	[0, 0, 0, 0, 0, 0, 0, 0],
			"position":	[3.8999786376953125, 0.399993896484375, 6.5],
			"rotation":	[0, 0.749267578125, 0],
			"name":	"ForestMonkBarStr",
			"waypoints":	[]
		}, {
			"params":	[0, 0, 0, 0, 0, 0, 0, 0],
			"position":	[3.15496826171875, 0.399993896484375, 6.498748779296875],
			"rotation":	[0, 0.749267578125, 0],
			"name":	"ForestMonkBarStr",
			"waypoints":	[]
		}, {
			"params":	[0, 0, 0, 0, 0, 0, 0, 0],
			"position":	[2.40997314453125, 0.399993896484375, 6.5],
			"rotation":	[0, 0.749267578125, 0],
			"name":	"ForestMonkBarStr",
			"waypoints":	[]
		}, {
			"params":	[0, 0, 0, 0, 0, 0, 0, 0],
			"position":	[4.6449737548828125, 0.399993896484375, 6.5],
			"rotation":	[0, 0.249755859375, 0],
			"name":	"ForestMonkBarStr",
			"waypoints":	[]
		}, {
			"params":	[0, 0, 0, 0, 0, 0, 0, 0],
			"position":	[5.3899688720703125, 0.399993896484375, 6.5],
			"rotation":	[0, 0.249755859375, 0],
			"name":	"ForestMonkBarStr",
			"waypoints":	[]
		}, {
			"params":	[0, 0, 0, 0, 0, 0, 0, 0],
			"position":	[5.944976806640625, 0.399993896484375, 6.5012359619140625],
			"rotation":	[0, 0.249755859375, 0],
			"name":	"ForestMonkBarEnd",
			"waypoints":	[]
		}, {
			"params":	[0, 0, 0, 0, 0, 0, 0, 0],
			"position":	[1.8549652099609375, 0.399993896484375, 6.498748779296875],
			"rotation":	[0, 0.749267578125, 0],
			"name":	"ForestMonkBarEnd",
			"waypoints":	[]
		}, {
			"params":	[13107, 0, 0, 0, 0, 0, 0, 0],
			"position":	[2.5, 0, 6.53125],
			"rotation":	[0, 0, 0],
			"name":	"Crystal",
			"waypoints":	[]
		}, {
			"params":	[13107, 0, 0, 0, 0, 0, 0, 0],
			"position":	[5.5, 0, 6.53125],
			"rotation":	[0, 0, 0],
			"name":	"Crystal",
			"waypoints":	[]
		}, {
			"params":	[13107, 0, 0, 0, 0, 0, 0, 0],
			"position":	[3.5, 0, 6.5],
			"rotation":	[0, 0, 0],
			"name":	"Crystal_B",
			"waypoints":	[]
		}, {
			"params":	[13107, 0, 0, 0, 0, 0, 0, 0],
			"position":	[4.5, 0, 6.5],
			"rotation":	[0, 0, 0],
			"name":	"Crystal_O",
			"waypoints":	[]
		}, {
			"params":	[0, 0, 0, 0, 0, 0, 0, 0],
			"position":	[6.9999847412109375, 0, 6.5],
			"rotation":	[0, 0.874267578125, 0],
			"name":	"SmashBlockGobbo",
			"waypoints":	[]
		}, {
			"params":	[0, 0, 0, 0, 0, 0, 0, 0],
			"position":	[0.274993896484375, 0, 6.5],
			"rotation":	[0, 0.902099609375, 0],
			"name":	"SmashBlock",
			"waypoints":	[]
		}, {
			"params":	[0, 0, 0, 0, 0, 0, 0, 0],
			"position":	[4, 0, 10.53125],
			"rotation":	[0, 0.49951171875, 0],
			"name":	"NormalDoor",
			"waypoints":	[]
		}],
	"doors":	[{
			"position":	[3, 0, 2],
			"level":	0,
			"sublevel":	0,
			"flags":	[],
			"id":	0
		}, {
			"position":	[3, 0, 3],
			"level":	0,
			"sublevel":	0,
			"flags":	[],
			"id":	0
		}, {
			"position":	[4, 0, 3],
			"level":	0,
			"sublevel":	0,
			"flags":	["start"],
			"id":	0
		}, {
			"position":	[4, 0, 11],
			"level":	20,
			"sublevel":	1,
			"flags":	["normal"],
			"id":	0
		}],
	"point_lights":	[],
	"direct_lights":	[{
			"position":	[0, 1, 0],
			"colour":	[64, 64, 64]
		}, {
			"position":	[0, 0.5, 0.865966796875],
			"colour":	[255, 255, 128]
		}, {
			"position":	[0, 0.5, -0.000244140625],
			"colour":	[43, 43, 43]
		}],
	"ambient_colour":	[64, 64, 64]
}