{
	"_meta":	{
		"version":	20,
		"format":	"normal",
		"level":	0,
		"sublevel":	4,
		"checksum":	51241
	},
	"path":	"P:\\CROC\\EDITOR\\MAPS\\GAME\\DESERT\\LEVEL6\\MAP5.MAP",
	"name":	"final level 5",
	"width":	16,
	"height":	16,
	"depth":	32,
	"style":	"desert",
	"flags":	4,
	"cd_track":	28,
	"background":	29,
	"effect":	"none",
	"wait":	0,
	"ambience":	"tomb",
	"start_rotation":	0.244140625,
	"tracks":	[{
			"position":	[9, 2, 1],
			"yr":	0.5,
			"index":	77
		}, {
			"position":	[10, 2, 1],
			"yr":	0.5,
			"index":	43
		}, {
			"position":	[11, 2, 1],
			"yr":	0.25,
			"index":	77
		}, {
			"position":	[9, 2, 2],
			"yr":	0.75,
			"index":	43
		}, {
			"position":	[10, 2, 2],
			"yr":	0,
			"index":	64
		}, {
			"position":	[11, 2, 2],
			"yr":	0.25,
			"index":	43
		}, {
			"position":	[9, 2, 3],
			"yr":	0.75,
			"index":	77
		}, {
			"position":	[10, 2, 3],
			"yr":	0,
			"index":	43
		}, {
			"position":	[11, 2, 3],
			"yr":	0,
			"index":	77
		}, {
			"position":	[9, 2, 4],
			"yr":	0.5,
			"index":	77
		}, {
			"position":	[10, 2, 4],
			"yr":	0.5,
			"index":	43
		}, {
			"position":	[11, 2, 4],
			"yr":	0.25,
			"index":	77
		}, {
			"position":	[9, 2, 5],
			"yr":	0.75,
			"index":	43
		}, {
			"position":	[10, 2, 5],
			"yr":	0,
			"index":	64
		}, {
			"position":	[11, 2, 5],
			"yr":	0.25,
			"index":	43
		}, {
			"position":	[1, 0, 6],
			"yr":	0.5,
			"index":	77
		}, {
			"position":	[2, 0, 6],
			"yr":	0.5,
			"index":	43
		}, {
			"position":	[3, 0, 6],
			"yr":	0.5,
			"index":	43
		}, {
			"position":	[4, 0, 6],
			"yr":	0.5,
			"index":	43
		}, {
			"position":	[5, 0, 6],
			"yr":	0.25,
			"index":	77
		}, {
			"position":	[9, 2, 6],
			"yr":	0.75,
			"index":	77
		}, {
			"position":	[10, 2, 6],
			"yr":	0,
			"index":	43
		}, {
			"position":	[11, 2, 6],
			"yr":	0,
			"index":	77
		}, {
			"position":	[1, 0, 7],
			"yr":	0.75,
			"index":	43
		}, {
			"position":	[2, 0, 7],
			"yr":	0,
			"index":	37
		}, {
			"position":	[3, 0, 7],
			"yr":	0,
			"index":	37
		}, {
			"position":	[4, 0, 7],
			"yr":	0,
			"index":	37
		}, {
			"position":	[5, 0, 7],
			"yr":	0.25,
			"index":	43
		}, {
			"position":	[6, 1, 7],
			"yr":	0.5,
			"index":	77
		}, {
			"position":	[7, 1, 7],
			"yr":	0.5,
			"index":	43
		}, {
			"position":	[8, 1, 7],
			"yr":	0.25,
			"index":	77
		}, {
			"position":	[9, 2, 7],
			"yr":	0.5,
			"index":	77
		}, {
			"position":	[10, 2, 7],
			"yr":	0.5,
			"index":	43
		}, {
			"position":	[11, 2, 7],
			"yr":	0.25,
			"index":	77
		}, {
			"position":	[1, 0, 8],
			"yr":	0.75,
			"index":	43
		}, {
			"position":	[2, 0, 8],
			"yr":	0,
			"index":	37
		}, {
			"position":	[3, 0, 8],
			"yr":	0.25,
			"index":	54
		}, {
			"position":	[4, 0, 8],
			"yr":	0.25,
			"index":	37
		}, {
			"position":	[5, 0, 8],
			"yr":	0.25,
			"index":	43
		}, {
			"position":	[6, 1, 8],
			"yr":	0.75,
			"index":	43
		}, {
			"position":	[7, 1, 8],
			"yr":	0,
			"index":	64
		}, {
			"position":	[8, 1, 8],
			"yr":	0.25,
			"index":	43
		}, {
			"position":	[9, 2, 8],
			"yr":	0.75,
			"index":	43
		}, {
			"position":	[10, 2, 8],
			"yr":	0,
			"index":	64
		}, {
			"position":	[11, 2, 8],
			"yr":	0.25,
			"index":	43
		}, {
			"position":	[1, 0, 9],
			"yr":	0.75,
			"index":	43
		}, {
			"position":	[2, 0, 9],
			"yr":	0,
			"index":	37
		}, {
			"position":	[3, 0, 9],
			"yr":	0,
			"index":	37
		}, {
			"position":	[4, 0, 9],
			"yr":	0.25,
			"index":	37
		}, {
			"position":	[5, 0, 9],
			"yr":	0.25,
			"index":	43
		}, {
			"position":	[6, 1, 9],
			"yr":	0.75,
			"index":	77
		}, {
			"position":	[7, 1, 9],
			"yr":	0,
			"index":	43
		}, {
			"position":	[8, 1, 9],
			"yr":	0,
			"index":	77
		}, {
			"position":	[9, 2, 9],
			"yr":	0.75,
			"index":	77
		}, {
			"position":	[10, 2, 9],
			"yr":	0,
			"index":	43
		}, {
			"position":	[11, 2, 9],
			"yr":	0,
			"index":	77
		}, {
			"position":	[1, 0, 10],
			"yr":	0.75,
			"index":	77
		}, {
			"position":	[2, 0, 10],
			"yr":	0,
			"index":	43
		}, {
			"position":	[3, 0, 10],
			"yr":	0,
			"index":	43
		}, {
			"position":	[4, 0, 10],
			"yr":	0,
			"index":	43
		}, {
			"position":	[5, 0, 10],
			"yr":	0,
			"index":	77
		}],
	"strats":	[{
			"params":	[0, 0, 0, 0, 0, 0, 0, 0],
			"position":	[47.199951171875, 0, 119.099853515625],
			"rotation":	[0, 0, 0],
			"name":	"Crystal",
			"waypoints":	[]
		}, {
			"params":	[0, 0, 0, 0, 0, 0, 0, 0],
			"position":	[52.7998046875, 0, 122.059814453125],
			"rotation":	[0, 0, 0],
			"name":	"Crystal",
			"waypoints":	[]
		}, {
			"params":	[0, 0, 0, 0, 0, 0, 0, 0],
			"position":	[54.639892578125, 0, 127.81982421875],
			"rotation":	[0, 0, 0],
			"name":	"Crystal",
			"waypoints":	[]
		}, {
			"params":	[0, 0, 0, 0, 0, 0, 0, 0],
			"position":	[52.639892578125, 0, 133.659912109375],
			"rotation":	[0, 0, 0],
			"name":	"Crystal",
			"waypoints":	[]
		}, {
			"params":	[0, 0, 0, 0, 0, 0, 0, 0],
			"position":	[47.679931640625, 0, 136.4599609375],
			"rotation":	[0, 0, 0],
			"name":	"Crystal",
			"waypoints":	[]
		}, {
			"params":	[0, 0, 0, 0, 0, 0, 0, 0],
			"position":	[42.719970703125, 0, 134.77978515625],
			"rotation":	[0, 0, 0],
			"name":	"Crystal",
			"waypoints":	[]
		}, {
			"params":	[0, 0, 0, 0, 0, 0, 0, 0],
			"position":	[40.47998046875, 0, 129.39990234375],
			"rotation":	[0, 0, 0],
			"name":	"Crystal",
			"waypoints":	[]
		}, {
			"params":	[0, 0, 0, 0, 0, 0, 0, 0],
			"position":	[41.83984375, 0, 121.97998046875],
			"rotation":	[0, 0, 0],
			"name":	"Crystal",
			"waypoints":	[]
		}, {
			"params":	[0, 0, 0, 0, 0, 0, 0, 0],
			"position":	[116, 1.599853515625, 128.5],
			"rotation":	[0, 0, 0],
			"name":	"SmashBlock",
			"waypoints":	[]
		}, {
			"params":	[98304, 2949120, 0, 0, 0, 0, 0, 0],
			"position":	[110, 0, 129],
			"rotation":	[0, 0.749267578125, 0],
			"name":	"DantiniZap",
			"waypoints":	[{
					"position":	[110, 0, 130],
					"var":	0
				}]
		}, {
			"params":	[0, 65536, 0, 0, 131072, 0, 196608, 0],
			"position":	[80.39990234375, 0, 129],
			"rotation":	[0, 0.249755859375, 0],
			"name":	"PlatformNormal",
			"waypoints":	[{
					"position":	[80.47998046875, 0, 128.81982421875],
					"var":	65536
				}, {
					"position":	[97.039794921875, 1.599853515625, 128.5],
					"var":	65536
				}]
		}, {
			"params":	[0, 65536, 0, 0, 131072, 0, 196608, 0],
			"position":	[126, 1.759765625, 128.5],
			"rotation":	[0, 0.249755859375, 0],
			"name":	"PlatformNormal",
			"waypoints":	[{
					"position":	[126, 1.759765625, 128.47998046875],
					"var":	65536
				}, {
					"position":	[144, 3.199951171875, 128.2998046875],
					"var":	65536
				}]
		}, {
			"params":	[196608, 0, 0, 0, 0, 0, 0, 0],
			"position":	[165.27978515625, 3.999755859375, 129.5],
			"rotation":	[0, 0, 0],
			"name":	"SmashBlockBonus",
			"waypoints":	[]
		}, {
			"params":	[98304, 2949120, 0, 0, 0, 0, 0, 0],
			"position":	[156, 4.639892578125, 129],
			"rotation":	[0, 0.749267578125, 0],
			"name":	"DantiniZap",
			"waypoints":	[{
					"position":	[156, 4.639892578125, 129],
					"var":	0
				}]
		}, {
			"params":	[0, 0, 0, 0, 0, 0, 0, 0],
			"position":	[160, 16.31982421875, 119.2998046875],
			"rotation":	[0, 0, 0],
			"name":	"ForestMonkBarEnd",
			"waypoints":	[]
		}, {
			"params":	[0, 0, 0, 0, 0, 0, 0, 0],
			"position":	[160, 16.31982421875, 110.419921875],
			"rotation":	[0, 0, 0],
			"name":	"ForestMonkBarStr",
			"waypoints":	[]
		}, {
			"params":	[0, 0, 0, 0, 0, 0, 0, 0],
			"position":	[160, 16.31982421875, 98.539794921875],
			"rotation":	[0, 0, 0],
			"name":	"ForestMonkBarStr",
			"waypoints":	[]
		}, {
			"params":	[0, 0, 0, 0, 0, 0, 0, 0],
			"position":	[160, 16.31982421875, 89.639892578125],
			"rotation":	[0, 0.49951171875, 0],
			"name":	"ForestMonkBarEnd",
			"waypoints":	[]
		}, {
			"params":	[0, 0, 0, 0, 0, 0, 0, 0],
			"position":	[160, 4.47998046875, 77.5],
			"rotation":	[0, 0, 0],
			"name":	"Spring",
			"waypoints":	[]
		}, {
			"params":	[0, 0, 0, 0, 0, 0, 0, 0],
			"position":	[159.119873046875, 3.679931640625, 33],
			"rotation":	[0, 0, 0],
			"name":	"Spring",
			"waypoints":	[]
		}, {
			"params":	[65536, 0, 0, 0, 0, 0, 0, 0],
			"position":	[159.679931640625, 1.43994140625, 56],
			"rotation":	[0, 0, 0],
			"name":	"PlatformCrumble",
			"waypoints":	[]
		}, {
			"params":	[0, 0, 0, 0, 0, 0, 0, 0],
			"position":	[159.199951171875, 22.079833984375, 32.85986328125],
			"rotation":	[0, 0, 0],
			"name":	"KeyForLockedDoorFloat",
			"waypoints":	[]
		}],
	"doors":	[{
			"position":	[3, 0, 8],
			"level":	36,
			"sublevel":	3,
			"flags":	["floor", "start"],
			"id":	0
		}],
	"point_lights":	[],
	"direct_lights":	[{
			"position":	[0, 1, 0],
			"colour":	[72, 72, 64]
		}, {
			"position":	[0, 0.5, 0.865966796875],
			"colour":	[255, 255, 128]
		}, {
			"position":	[0, 0.5, -0.000244140625],
			"colour":	[56, 56, 48]
		}],
	"ambient_colour":	[144, 144, 128]
}