{
	"_meta":	{
		"version":	12,
		"format":	"v12_old",
		"level":	13,
		"sublevel":	2,
		"checksum":	0
	},
	"path":	"P:\\CROC\\EDITOR\\MAPS\\GAME\\ISLAND1\\LEVEL4\\MAP3.MAP",
	"name":	"All Together Now",
	"width":	16,
	"height":	16,
	"depth":	32,
	"style":	"wood",
	"flags":	8,
	"cd_track":	23,
	"background":	16,
	"effect":	"none",
	"wait":	0,
	"ambience":	"nght",
	"start_rotation":	0.49951171875,
	"tracks":	[{
			"position":	[2, 0, 3],
			"yr":	0.25,
			"index":	98
		}, {
			"position":	[3, 0, 3],
			"yr":	0,
			"index":	95
		}, {
			"position":	[4, 0, 3],
			"yr":	0,
			"index":	95
		}, {
			"position":	[5, 0, 3],
			"yr":	0,
			"index":	98
		}, {
			"position":	[0, 0, 4],
			"yr":	0.75,
			"index":	48
		}, {
			"position":	[2, 0, 4],
			"yr":	0.25,
			"index":	25
		}, {
			"position":	[3, 0, 4],
			"yr":	0.5,
			"index":	24
		}, {
			"position":	[4, 0, 4],
			"yr":	0.25,
			"index":	24
		}, {
			"position":	[5, 0, 4],
			"yr":	0.75,
			"index":	26
		}, {
			"position":	[7, 0, 4],
			"yr":	0.25,
			"index":	48
		}, {
			"position":	[0, 0, 5],
			"yr":	0.75,
			"index":	50
		}, {
			"position":	[2, 0, 5],
			"yr":	0.5,
			"index":	3
		}, {
			"position":	[3, 0, 5],
			"yr":	0,
			"index":	0
		}, {
			"position":	[4, 0, 5],
			"yr":	0.5,
			"index":	61
		}, {
			"position":	[5, 0, 5],
			"yr":	0.75,
			"index":	3
		}, {
			"position":	[7, 0, 5],
			"yr":	0.25,
			"index":	50
		}, {
			"position":	[1, 0, 6],
			"yr":	0,
			"index":	55
		}, {
			"position":	[3, 0, 6],
			"yr":	0.5,
			"index":	79
		}, {
			"position":	[6, 0, 6],
			"yr":	0.25,
			"index":	55
		}, {
			"position":	[2, 0, 7],
			"yr":	0,
			"index":	50
		}, {
			"position":	[3, 0, 7],
			"yr":	0,
			"index":	50
		}, {
			"position":	[4, 0, 7],
			"yr":	0,
			"index":	50
		}, {
			"position":	[5, 0, 7],
			"yr":	0,
			"index":	50
		}, {
			"position":	[2, 8, 0],
			"yr":	0.75,
			"index":	56
		}, {
			"position":	[5, 8, 0],
			"yr":	0.5,
			"index":	56
		}, {
			"position":	[1, 8, 1],
			"yr":	0.75,
			"index":	55
		}, {
			"position":	[6, 8, 1],
			"yr":	0.5,
			"index":	55
		}, {
			"position":	[0, 8, 2],
			"yr":	0.75,
			"index":	50
		}, {
			"position":	[7, 8, 2],
			"yr":	0.25,
			"index":	50
		}, {
			"position":	[0, 8, 3],
			"yr":	0.75,
			"index":	50
		}, {
			"position":	[2, 8, 3],
			"yr":	0.25,
			"index":	55
		}, {
			"position":	[3, 8, 3],
			"yr":	0,
			"index":	50
		}, {
			"position":	[4, 8, 3],
			"yr":	0,
			"index":	50
		}, {
			"position":	[5, 8, 3],
			"yr":	0,
			"index":	55
		}, {
			"position":	[7, 8, 3],
			"yr":	0.25,
			"index":	50
		}, {
			"position":	[0, 8, 4],
			"yr":	0.75,
			"index":	50
		}, {
			"position":	[1, 8, 4],
			"yr":	0.25,
			"index":	3
		}, {
			"position":	[6, 8, 4],
			"yr":	0,
			"index":	3
		}, {
			"position":	[7, 8, 4],
			"yr":	0.25,
			"index":	50
		}, {
			"position":	[1, 8, 5],
			"yr":	0,
			"index":	0
		}, {
			"position":	[6, 8, 5],
			"yr":	0,
			"index":	0
		}, {
			"position":	[2, 8, 6],
			"yr":	0.25,
			"index":	40
		}, {
			"position":	[3, 8, 6],
			"yr":	0.75,
			"index":	35
		}, {
			"position":	[4, 8, 6],
			"yr":	0.75,
			"index":	35
		}, {
			"position":	[5, 8, 6],
			"yr":	0.75,
			"index":	40
		}, {
			"position":	[2, 16, 0],
			"yr":	0.75,
			"index":	55
		}, {
			"position":	[3, 16, 0],
			"yr":	0,
			"index":	64
		}, {
			"position":	[4, 16, 0],
			"yr":	0,
			"index":	64
		}, {
			"position":	[5, 16, 0],
			"yr":	0.5,
			"index":	55
		}, {
			"position":	[2, 16, 1],
			"yr":	0,
			"index":	3
		}, {
			"position":	[3, 16, 1],
			"yr":	0,
			"index":	92
		}, {
			"position":	[5, 16, 1],
			"yr":	0.25,
			"index":	3
		}, {
			"position":	[1, 16, 2],
			"yr":	0,
			"index":	36
		}, {
			"position":	[2, 16, 2],
			"yr":	0.75,
			"index":	40
		}, {
			"position":	[3, 16, 2],
			"yr":	0,
			"index":	91
		}, {
			"position":	[4, 16, 2],
			"yr":	0,
			"index":	61
		}, {
			"position":	[5, 16, 2],
			"yr":	0.25,
			"index":	40
		}, {
			"position":	[6, 16, 2],
			"yr":	0.75,
			"index":	36
		}, {
			"position":	[1, 16, 3],
			"yr":	0.5,
			"index":	40
		}, {
			"position":	[6, 16, 3],
			"yr":	0.5,
			"index":	40
		}, {
			"position":	[3, 24, 0],
			"yr":	0,
			"index":	23
		}, {
			"position":	[4, 24, 0],
			"yr":	0.75,
			"index":	23
		}, {
			"position":	[3, 24, 1],
			"yr":	0.25,
			"index":	23
		}, {
			"position":	[4, 24, 1],
			"yr":	0.5,
			"index":	24
		}],
	"strats":	[{
			"params":	[0, 0, 0, 0, 0, 0, 0, 0],
			"position":	[2.868743896484375, 0.9666595458984375, 5.15625],
			"rotation":	[0, 0, 0],
			"name":	"PlatformDead",
			"waypoints":	[]
		}, {
			"params":	[0, 0, 0, 0, 0, 0, 0, 0],
			"position":	[2.90625, 1.0749969482421875, 4.46875],
			"rotation":	[0, 0, 0],
			"name":	"PlatformDead",
			"waypoints":	[]
		}, {
			"params":	[0, 0, 0, 0, 0, 0, 0, 0],
			"position":	[3.3562469482421875, 1.2166595458984375, 4.33123779296875],
			"rotation":	[0, 0, 0],
			"name":	"PlatformDead",
			"waypoints":	[]
		}, {
			"params":	[0, 0, 0, 0, 0, 0, 0, 0],
			"position":	[3.7562408447265625, 1.3749847412109375, 4.0437469482421875],
			"rotation":	[0, 0, 0],
			"name":	"PlatformDead",
			"waypoints":	[]
		}, {
			"params":	[0, 0, 0, 0, 0, 0, 0, 0],
			"position":	[4.2562408447265625, 1.524993896484375, 3.8499908447265625],
			"rotation":	[0, 0, 0],
			"name":	"PlatformDead",
			"waypoints":	[]
		}, {
			"params":	[0, 0, 0, 0, 0, 0, 0, 0],
			"position":	[4.7199859619140625, 1.683319091796875, 3.738739013671875],
			"rotation":	[0, 0, 0],
			"name":	"PlatformDead",
			"waypoints":	[]
		}, {
			"params":	[0, 0, 0, 0, 0, 0, 0, 0],
			"position":	[3.4974822998046875, 2.89166259765625, 0.4774932861328125],
			"rotation":	[0, 0, 0],
			"name":	"PlatformDead",
			"waypoints":	[]
		}, {
			"params":	[983040, 0, 0, 0, 0, 0, 0, 0],
			"position":	[3.3249969482421875, 1.3499908447265625, 4.29998779296875],
			"rotation":	[0, 0, 0],
			"name":	"Jumpy",
			"waypoints":	[{
					"position":	[3.3549957275390625, 1.3499908447265625, 4.319976806640625],
					"var":	0
				}]
		}, {
			"params":	[0, 0, 0, 0, 0, 0, 0, 0],
			"position":	[4.2549896240234375, 1.649993896484375, 3.8399810791015625],
			"rotation":	[0, 0, 0],
			"name":	"Jumpy",
			"waypoints":	[{
					"position":	[4.2537384033203125, 1.649993896484375, 3.8599700927734375],
					"var":	0
				}]
		}, {
			"params":	[0, 0, 0, 0, 0, 0, 0, 0],
			"position":	[2.8762359619140625, 1.0833282470703125, 5.125],
			"rotation":	[0, 0, 0],
			"name":	"Crystal",
			"waypoints":	[]
		}, {
			"params":	[0, 0, 0, 0, 0, 0, 0, 0],
			"position":	[2.899993896484375, 1.1999969482421875, 4.467498779296875],
			"rotation":	[0, 0, 0],
			"name":	"Crystal",
			"waypoints":	[]
		}, {
			"params":	[0, 0, 0, 0, 0, 0, 0, 0],
			"position":	[3.7549896240234375, 1.5, 4.0437469482421875],
			"rotation":	[0, 0, 0],
			"name":	"Crystal",
			"waypoints":	[]
		}, {
			"params":	[0, 0, 0, 0, 0, 0, 0, 0],
			"position":	[4.6987457275390625, 1.8333282470703125, 3.74749755859375],
			"rotation":	[0, 0, 0],
			"name":	"Crystal",
			"waypoints":	[]
		}, {
			"params":	[0, 0, 0, 0, 0, 0, 0, 0],
			"position":	[3, 0, 5.6962432861328125],
			"rotation":	[0, 0.49951171875, 0],
			"name":	"NormalDoor",
			"waypoints":	[]
		}, {
			"params":	[0, 0, 0, 0, 0, 0, 0, 0],
			"position":	[6.199981689453125, 2, 3.9375],
			"rotation":	[0, 0.49951171875, 0],
			"name":	"SmashBlockGobbo",
			"waypoints":	[]
		}, {
			"params":	[0, 0, 0, 0, 0, 0, 0, 0],
			"position":	[3.489990234375, 3.25, 0.46875],
			"rotation":	[0, 0, 0],
			"name":	"Letter_S",
			"waypoints":	[]
		}, {
			"params":	[0, 0, 0, 0, 0, 0, 0, 0],
			"position":	[3, 2, 1.4375],
			"rotation":	[0, 0, 0],
			"name":	"BonusDoor",
			"waypoints":	[]
		}, {
			"params":	[0, 0, 0, 0, 0, 0, 0, 0],
			"position":	[1, 2, 2.96875],
			"rotation":	[0, 0.49951171875, 0],
			"name":	"FinalExit",
			"waypoints":	[]
		}, {
			"params":	[65536, 0, 0, 0, 0, 0, 0, 0],
			"position":	[4.375, 0, 3.5625],
			"rotation":	[0, 0, 0],
			"name":	"LavaBlubs",
			"waypoints":	[{
					"position":	[4.125, 0, 3.40625],
					"var":	0
				}, {
					"position":	[2.75, 0, 3.40625],
					"var":	0
				}, {
					"position":	[2, 0, 3.84375],
					"var":	0
				}, {
					"position":	[5.125, 0, 3.84375],
					"var":	0
				}]
		}, {
			"params":	[0, 0, 0, 0, 0, 0, 0, 0],
			"position":	[1, 1, 5],
			"rotation":	[0, 0, 0],
			"name":	"SmashBlockGobbo",
			"waypoints":	[]
		}],
	"doors":	[{
			"position":	[3, 0, 5],
			"level":	0,
			"sublevel":	0,
			"flags":	["start"],
			"id":	0
		}, {
			"position":	[3, 0, 6],
			"level":	13,
			"sublevel":	1,
			"flags":	["normal"],
			"id":	0
		}, {
			"position":	[3, 2, 1],
			"level":	13,
			"sublevel":	4,
			"flags":	["normal"],
			"id":	0
		}],
	"point_lights":	[{
			"position":	[3.875, 0.5833282470703125, 5],
			"colour":	[83, 143, 151],
			"fade_from":	0.001953125,
			"fade_to":	0.01171875
		}],
	"direct_lights":	[{
			"position":	[0, 0.00390625, 0],
			"colour":	[64, 64, 0]
		}, {
			"position":	[0, -2.310546875, 0.003173828125],
			"colour":	[255, 128, 0]
		}, {
			"position":	[0, -0.060546875, 0.062255859375],
			"colour":	[43, 43, 0]
		}],
	"ambient_colour":	[55, 55, 0]
}