{
	"_meta":	{
		"version":	20,
		"format":	"normal",
		"level":	83,
		"sublevel":	3,
		"checksum":	9061
	},
	"path":	"P:\\CROC\\EDITOR\\MAPS\\GAME\\INTROS\\OUTRO\\JIG4.MAP",
	"name":	"Default New Map",
	"width":	16,
	"height":	16,
	"depth":	32,
	"style":	"castle",
	"flags":	0,
	"cd_track":	0,
	"background":	24,
	"effect":	"none",
	"wait":	0,
	"ambience":	"none",
	"start_rotation":	0.49951171875,
	"tracks":	[],
	"strats":	[{
			"params":	[0, 0, 0, 0, 0, 0, 0, 0],
			"position":	[64, 5.97314453125, 32.999755859375],
			"rotation":	[0, 0, 0],
			"name":	"IntroStart",
			"waypoints":	[]
		}],
	"doors":	[],
	"point_lights":	[],
	"direct_lights":	[{
			"position":	[0, 1, 0],
			"colour":	[64, 64, 64]
		}, {
			"position":	[0, 0.5, 0.865966796875],
			"colour":	[255, 255, 104]
		}, {
			"position":	[0, 0.5, -0.000244140625],
			"colour":	[48, 48, 48]
		}],
	"ambient_colour":	[64, 64, 64]
}